<?xml version="1.0" encoding="UTF-8"?>
<dataroot xmlns:od="urn:schemas-microsoft-com:officedata" xmlns:xsi="http://www.w3.org/2001/XMLSchema-instance"  xsi:noNamespaceSchemaLocation="ItemSpreadsheet.xsd" generated="2015-10-17T20:13:56">
<Item>
<ItemID>1</ItemID>
<ItemName>Basic Sword</ItemName>
<ItemType>WEAPON</ItemType>
</Item>
<Item>
<ItemID>2</ItemID>
<ItemName>Great Sword</ItemName>
<ItemType>WEAPON</ItemType>
</Item>
</dataroot>
